{"dimension":"2d","objects":[{"description":"Owns scene composition and coordinates input, puzzle state, board rendering, and HUD updates. Input actions are handled separately in puzzle_input.gd.","fields":[],"id":"main-scene","kind":"scene","name":"Light Grid Main Scene","parentId":null,"relations":[{"targetId":"puzzle-board","type":"contains"},{"targetId":"rules","type":"contains"},{"targetId":"hud","type":"contains"}],"sourceBindings":["scenes/main.tscn","scripts/main.gd","scripts/puzzle_input.gd"]},{"description":"Renders nine square buttons in three rows and three columns. Emits cell selections and displays state supplied by the rules. Lit squares use the chosen accent; unlit squares use a dark neutral fill. ON and OFF labels distinguish states independently of color.","fields":[{"editable":true,"id":"accent-color","label":"Accent color","options":["#38BDF8","#A78BFA","#FBBF24"],"type":"choice","value":"#38BDF8"}],"id":"puzzle-board","kind":"entity","name":"Puzzle Board","parentId":"main-scene","relations":[{"targetId":"rules","type":"displays-state-of"}],"sourceBindings":["scripts/puzzle_board.gd"]},{"description":"Owns the nine light states, legal toggles, deterministic start generation, move count, solved detection, and reset. Contains no rendering or input handling.","fields":[],"id":"rules","kind":"rule","name":"Lights Out Rules","parentId":"main-scene","relations":[],"sourceBindings":["scripts/rules.gd"]},{"description":"Displays Light Grid, instructions, move count, Reset, and the win message. Emits reset requests without mutating puzzle state.","fields":[],"id":"hud","kind":"interface","name":"Puzzle HUD","parentId":"main-scene","relations":[{"targetId":"rules","type":"displays-progress-of"}],"sourceBindings":["scripts/hud.gd"]}],"requirements":[{"id":"project-scope","objectIds":["main-scene","puzzle-board","rules","hud"],"text":"Implement one local Godot 4 GDScript 2D puzzle. Use procedural visuals and native controls only. Exclude external assets, plugins, network access, audio, additional levels, persistence, and export packaging from this MVP.","verification":"manual"},{"id":"fixed-window","objectIds":["main-scene","puzzle-board","hud"],"text":"Run in a fixed, non-resizable 960×540 window. Keep the complete board, title, instructions, move counter, Reset button, and win message visible without scrolling or overlap.","verification":"manual"},{"id":"board-layout","objectIds":["puzzle-board"],"text":"Display exactly nine evenly spaced square buttons as a centered 3×3 grid. Each button shows its current ON or OFF state. Provide clear hover and pressed feedback while retaining readable state labels.","verification":"manual"},{"id":"toggle-rule","objectIds":["puzzle-board","rules"],"text":"Before a win, one mouse activation toggles the selected cell and each in-bounds orthogonal neighbor exactly once. Do not toggle diagonal cells or wrap at edges. A corner affects three cells, an edge-center affects four, and the center affects five.","verification":"manual"},{"id":"solvable-start","objectIds":["rules"],"text":"Generate the fixed start from nine OFF cells by applying the toggle rule to (0,0), (1,1), and (2,2), in order, using zero-based row and column coordinates. The required starting state has only the main diagonal ON. Seeding does not count as player moves. Replaying these three selections is the documented solution.","verification":"manual"},{"id":"move-count","objectIds":["rules","hud"],"text":"Display Moves: 0 on launch and reset. Increment the count once for each accepted cell activation, regardless of how many lights change. Preserve the final count when the puzzle is won.","verification":"manual"},{"id":"win-state","objectIds":["rules","puzzle-board","hud"],"text":"Detect a win when all nine lights are OFF after a player move. Show All lights out! and retain the final move count. Disable further cell activations until reset; keep both reset controls available.","verification":"manual"},{"id":"reset-controls","objectIds":["main-scene","puzzle-board","rules","hud"],"text":"The Reset button and the R key invoke the same reset operation before and after winning. Reset reconstructs the fixed starting board, sets moves to zero, clears the win message, and enables cell input. Ignore repeated key events from holding R. R must work when a board button or Reset has focus.","verification":"manual"},{"id":"hud-content","objectIds":["hud"],"text":"Show the title Light Grid and concise instructions explaining that clicking toggles a square and its orthogonal neighbors, the goal is all lights OFF, and R resets. Keep the move counter and Reset button visible throughout play.","verification":"manual"},{"id":"editable-accent","objectIds":["puzzle-board"],"text":"Expose puzzle-board.accent-color as the editable choice field defined in this document. Game source obtains its frozen value through StudioRuntime.object_value() and uses the selected hexadecimal color for lit squares. Each supported choice must retain readable labels and a clear distinction from unlit squares.","verification":"manual"},{"id":"separate-responsibilities","objectIds":["main-scene","puzzle-board","rules","hud"],"text":"Use scripts/rules.gd for simulation, scripts/puzzle_board.gd for board rendering, scripts/puzzle_input.gd for routing cell selections and the R reset input action, scripts/hud.gd for interface rendering and reset requests, and scripts/main.gd for coordination. Bind the main scene to scenes/main.tscn. Keep input and interface code from directly mutating the rules' board state.","verification":"manual"},{"id":"manual-gameplay-review","objectIds":["main-scene","puzzle-board","rules","hud"],"text":"Later manual review must inspect the initial diagonal pattern; check corner, edge-center, and center toggles from fresh resets; check one move per activation; solve with (0,0), (1,1), (2,2) and inspect the three-move win; check post-win input lock; exercise both reset controls during play and after winning; and inspect each accent choice. Record observed results without claiming formal verification.","verification":"manual"}],"schemaVersion":"studio.objects.v1","summary":"A small 2D puzzle in a fixed 960×540 window. Clicking a square toggles its light and its orthogonal neighbors. Turn every light off to win. Display moves, concise instructions, a Reset button, and a win message. Use procedural squares and labels without external assets, plugins, network, or audio.","title":"Light Grid"}
